{
  "schema_version": "aud-remediation-plan-v1",
  "plan_id": "RP-INTEGRATION-001",
  "run_id": "RUN-2026-09-04-002",
  "generated_at": "2026-09-04T09:40:00Z",
  "project_revision": "da063c38731f3f797bfd5000374daa5c14952782",
  "items": [{
    "remediation_id": "R-CONTEXT-001",
    "finding_refs": ["F-PRIOR-FLOW-001"],
    "cause_cluster_refs": [],
    "intended_result": "Restore comparison state after evidence inspection.",
    "scope": ["comparison route state"],
    "non_goals": ["visual redesign"],
    "dependencies": [],
    "implementation_approach": "Persist and restore route-addressable comparison state.",
    "alternatives_considered": [],
    "risk": { "level": "medium", "rationale": "Route state affects deep links." },
    "estimated_effort": "M",
    "acceptance_criteria": [{ "id": "AC-REMEDIATION-001", "statement": "Back restores selection and scroll anchor." }],
    "verification": { "owner": "functional-audit", "instruments": ["browser", "route-state assertion"] },
    "rollback_note": "Restore the prior route-state adapter.",
    "priority": { "level": "P1", "rationale": "Accepted by synthesis fixture." }
  }],
  "waves": [{ "wave": 1, "remediation_refs": ["R-CONTEXT-001"] }],
  "human_decisions": []
}
